language_id,questions,option1,option2,option3,option4,answer
1,Pollution of Ganga water is due to,Oil refinery in Mathura,Leather refinery in Kanpur,Soap factories in Kanpur,All of these,option4
1,Which of the following products obtained from coal is not properly matched to its usage?,"Coal tar - dyes, explosives, paints",Coal gas - fuel,Coke - Soft drink,None of the above,option3
1,"Choose the correct statement from the following,",It is difficult to transport natural gas through pipes.,Natural gas can not be used directly for burning in homes.,Natural gas is stored under high pressure as compressed natural gas.,Natural gas cannot be used for power generation.,option3
1,Many man-made projects use non-renewable resources such as oil or petroleum. Which of the following is a way to conserve non-renewable resources?,Reduce the number of disposable products we use,Reuse products more than once,Recycle items by using them for more than one purpose,All of the above,option4
1,Karnataka Government had launched ‘Project Elephant’ to save Asian elephants in the state. Which amongst the following statements reflect the purpose of the project.,Provide financial and technical support of wildlife management efforts,Creating conservation awareness among local people,Providing improved veterinary care for captive elephants,All of the above,option4
1,What does Carbon monoxide in vehicle exhaust causes?,Increased oxygen carrying capacity of RBCs,Reduced Nitrogen carrying capacity of RBCs,Reduced oxygen carrying capacity of RBCs,Reduced carbon carrying capacity of RBCs,option3
1,Why could it be dangerous to exercise outside during high levels of air pollution?,Exercise is bad for health,Deep breathing during exercise allows toxins further into the lungs,Pollutants can attack the fiber of clothes,Pollution makes surface slippery causing accidents,option2
1,Sajid observed ponds which looked green. What may have caused the pond water to change its colour?,Growth of algae,Growth of plants,Chemicals from industries,None of the above,option1
1,What would happen to a species if every member could not reproduce?,The species will become endangered and can be extinct.,The fertilization is not needed because they will do asexual reproduction.,The species will arise as a dominant population on Earth.,The organism will adapt and prevent early death cases.,option1
1,Polyethylene terephthalate belongs to which class of synthetic fibre?,Polyolefin,Nylon,Polyester,None of the above,option3
1,Which synthetic fibre is best suited to make a parachute and what property of the fibre is used?,"Polyester, Elasticity","Nylon, Elasticity","Polyester, High tensile strength","Nylon, High tensile strength",option4
1,Coal was produced on the earth over millions of years. Which of the following is NOT a step in the production of coal?,Animals died and were covered by sediment,Plants died and were covered by sediment,"Heat, pressure, and time change the peat to lignite",Time and pressure changes the dead plant to peat ,option1
1,Why are fossil fuels classified as nonrenewable?,They require expensive equipment,They take millions of years to replace,They can be found all over,They provide all the energy we use,option2
1,Which of the following constituents of petroleum is used in painting and road surfacing?,Bitumen,Petrol,Diesel,Oil,option1
1,Electricity is produced using many natural resources. Which inexhaustible resource can be used to produce electricity?,Petroleum,Natural gas,Water,Coal,option3
1,"In our country, large patches of forests are being cleared for cultivation of crops. The environmental impact of such a practice will lead to",Soil erosion,Soil pollution,Soil conservation,Soil fertility,option1
1,Which one of the following statements is true about a Biosphere Reserve?,It is meant to conserve both the biodiversity and the culture of that area,There are no other protected areas within its limits,,,option3
1,How does our government protect the rainforest of our country?,Prohibit the felling of trees that are not mature enough,Trees that have been chopped down are replanted,Discourage the use of pesticides,Both ‘a’ and ‘b’,option4
1,Name a biosphere reserve where the plants and animals are similar to those of the upper Himalayan ranges and lower western Ghats.,Nanda Devi Biosphere Reserve,Kaziranga Biosphere Reserve,Pachmarhi Biosphere Reserve,Dudhwa National Park,option3
1,Plants and animals that are found exclusively in a particular area is known as,Endemic species,Particular species,Significant species,Exclusive species,option1
1,Which of the following products contains harmful CFCs?,Refrigerators,Air conditioners,Aerosol sprays,All of these,option4
1,Incomplete combustion of fuel such as petrol and diesel gives which gas?,Nitrogen oxide,Carbon monoxide,Sulphur dioxide,Carbon dioxide,option2
1,Which of the following air pollutants is capable of preventing photosynthesis in plants?,Carbon dioxide,Nitrogen Oxides,Dust,Carbon monoxide,option3
1,The phenomenon of marble cancer is due to,Soil particles,Fog,CFCs,Acid rain,option4
1,What radiations are absorbed by CO2?,Ultrared radiations,Infrared radiations,Ultraviolet radiations,None of these,option2
1,What percentage of the global greenhouse gas emissions does the transportation sector emit?,1%,14%,33%,70%,option2
1,Which of the following statements about the ozone is correct?,It is essential for breathing,It absorbs ultraviolet rays,Its proportion in the air is about 3%.,It is mainly responsible for global warming,option2
1,Which of the following contents is most harmful to aquatic animals?,Heavy metal ions,Sodium ions,Potassium ions,Chloride ions,option1
1,In which year Ganga Action Plan was launched?,1980,1984,1982,1985,option4
1,"Students create a model of the formation of fossil fuels by first placing a layer of leaves, representing organic matter, in the bottom of a cup. What step will come next in the model?",Pouring water over the leaves to model washing away by rivers.,Adding sand on top of the leaves to model burial in sediments.,Burning the leaves to model the decay of organic matter.,Putting the leaves in the freezer to model conditions on top of mountains.,option2
1,"A substance X is obtained from an exhaustible natural resource. It is black and thick liquid with an unpleasant smell. Synthetic dye, plastic paints, and perfumes are obtained using this resource. Identify X",Coke,Coal tar,Bitumen,Lubricating oil,Option2
1,Boojho wrote some statements but he was confused to identify the incorrect statement. Choose the incorrect answer for him.,Petrol is used as a fuel in light motor vehicles.,Diesel is used as a fuel in heavy motor vehicles.,Lubrication oil is used for lubrication in machines and engines.,Bitumen is used in the medical industry.,option4
1,"Bobo was cooking and suddenly, the fuel of the stove got over. Which constituent of petroleum should he use to ignite the stove?",Kerosene,Diesel,Petrol,Paraffin wax,option1
1,Changing concentrations of ozone in upper atmosphere and at ground level can cause health problems for people. Which set of changes would cause the MOST health concerns?,Increase in both atmospheric and ground level ozone,Decrease in both atmospheric and ground level ozone,Increase in atmospheric ozone and a decrease in ground level ozone,Decrease in atmospheric ozone and an increase in ground level ozone,option4
1,"In pit A, Gappu put a polythene bag packed with some agricultural waste. In pit B, she dumped the same kind of waste but without packing it in a polythene bag. She then covered both the pits with soil. What did she observe after a month?",Waste in pit A degraded faster than that in pit B.,Waste in pit B degraded faster than that in pit A.,Waste in both pits degraded almost equally.,Waste in both pits did not degrade at all.,option2
1, Identify the last step of Nitrogen cycle.,Nitrogen compounds used by plants,Nitrogen compounds eaten by animals,Nitrogen compounds dissolved in water,Nitrogen compounds converted to gas by bacteria and released into the atmosphere.,option4
1,Displacement reactions will occur when:,A more reactive metal displaces a less reactive metal from its compound.,A less reactive metal displaces a more reactive metal from its compound,Displacement only occurs when two of the same metals are reacted,Displacement reactions will only occur in metals above iron in the reactivity series,option1
1,Choose the correct equation to represent when a magnesium ribbon is heated in the presence of air,2Mg + O2 + H2O → MgO2,2Mg + O2 → 2MgO,2Mg + O2 → MgO,None of the above,option2
1,An acid reacts with metal to produce:,Carbon dioxide,Hydrogen gas,Hydrogen gas and water,Salt and hydrogen gas,option4
1,Which of the following are combustible.,Iron nail,Glass,Steel,Wood,option4
1,Which of the following is not an inflammable substance?,Kerosene,Coal,Petrol,Alcohol,option2
1,Which of the following are required essentially for producing fire?,"Glass, coal, water","Fuel, coal, straw","Fire, wood, burner","Fuel, air, heat",option4
1,What is produced when a combustible substance is in the vapor state and burns strongly in the presence of air?,Heat,Light,Flame,Fumes,option3
1,Choose the ones that cannot burn without a flame.,Coal,Candle,Charcoal,Natural gas,option2
1,Choose the incorrect statement.,"The greater the calorific value, the better is the fuel.",Middle zone is the hottest zone of a flame.,The substances which vaporize during burning give flame.,All statements are incorrect,option2
1,What are the characteristics of an ideal fuel?,Should have high calorific value,Should have low calorific value,Should leave a lot of residues after burning,All of the above,option1
1,What is the significance of calorific value?,Helps in deciding which fuel is good,Helps in locating fuel,Helps in deciding ignition temperature,Helps in deciding fire point,option1
1,CNG (Compressed Natural Gas) in automobiles can reduce pollution in cities. What could be the correct reason for the same?,It produces less amount of Sulphur dioxide and chlorine.,It does not leave any residue or smoke after burning in the engine.,It produces a large amount of carbon dioxide,It is used in compressed form,option2
1,"Suppose you bring a burning candle near these materials one by one, which material(s) among milk, petrol, and mustard oil will catch fire instantly?",Petrol,Milk,Mustard oil,Both petrol and milk,option1
1,Choose the sources of light that cannot be used for reflection.,The sun,Torch light,Candle,Moonlight,Option4
1,"According to the laws of reflection, which option is correct?",i = r,i > r,i < r,i + r = 90°,Option1
1,What do we call the reflection of light back and forth several times through reflecting surfaces?,Multiple reflection,Diffused reflection,Regular reflection,None of the above,Option1
1,Multiple reflection occurs in which of the following objects?,Stethoscope,Kaleidoscope,Camera,Vehicle Mirrors,Option2
1,What is the 1st principle in laws of reflection about a ray of light hitting a smooth and shiny surface?,<i  is equal to the <r,<i  is complementary to the <r.,<i  is supplementary to <r.,<i  is opposite to <r,Option1
1,Choose the characteristic which is not true for the image formed by a plane mirror?,Real,Same size as of the object,Upright,Laterally Inverted,Option1
1,How can we take care of our eyes?,Do eye exercises and wash eyes daily,Study in adequate light at proper reading distance,Balanced diet including Vitamins and enough sleep,All of the above,Option4
1,Name the part of an eye where No vision is possible?,Cones,Cornea,Blind spot,Brain,Option3
1,The most comfortable distance at which humans can read with a normal eye?,24 cm,25 m,30 cm,25 cm,Option4
1,What is the other name for long-sightedness?,Myopia,Hypermetropia,Night blindness,Cataract,Option2
1,Where does the lens focus light in the human eye?,On the retina,On the pupil,At the optic nerve,None of the above,Option1
1,Which part of the eye controls the light entering into the eye?,Iris,Lens,Cornea,Retina,Option1
1,The speed of sound is maximum in,Liquid,Solid,Gases,None of the above,Option2
1,How do sounds reach your ears?,through waves that can be seen, through invisible waves caused by vibrations,through a series of beeps produced ,by bright lights that flash so fast you can't see them,Option2
1,Sound travels FASTEST through which of these materials?,Air,Empty space,Metal,Water,Option3
1,What range of sound is audible to the human ear?,200Hz - 2000Hz,"20Hz - 20,000Hz","2Hz - 20,000Hz","2000Hz - 2,00,000Hz",Option2
1,1 hertz is equal to,1 vibration per minute,10 vibrations per minute,60 vibrations per minute,600 vibrations per minute,Option3
1,What determines the pitch of a sound?,Frequency,Speed,Amplitude,Loudness,Option1
1,Which of the following conduct electricity?,Vinegar solution,Lemon juice solution,Caustic soda solution,All of the above,Option4
1,Food is stored in tin cans because,"It is airtight, so it protects from bacterial infection.","It is less reactive, so food doesn't get spoilt.",It looks better than iron or wooden containers.,It keeps the food warm and fresh.,Option2
1,Lightning can even burn up a tree. Lightning contains a tremendous amount of what?,Heat energy,Electric energy,Chemical energy,Nuclear energy,Option2
1,Which planet is called the Red planet?,Mars,Venus,Jupiter,Saturn,option1
1,Which star is nearest to the earth?,Pole star,Cassiopeia,Orion,Sun,option4
1,Which of the following is a weed?,Sunflower,Sugarcane,Rose,Wild grasses,option4
1,Which is not an example of Kharif crops?,Paddy,Maize,Soybean,Mustard,option4
1,Which of the following describes the advantage of ploughing?,It allows the penetration of roots of plants.,It helps in proper aeration and eradicates weeds.,It promotes the growth of useful soil bacteria.,All of the above,option4
1,The agricultural instrument used for the removal of weed is,Sickle,Khurpi,Seed drill,Plough,option2
1,Which instrument is used for spraying weedicides?,Sprayer,Cultivator,Plough,Combine,option1
1,Which of the following is used to preserve food grains at home?,Spinach leaves,Curry leaves,Neem leaves,Tulsi leaves,option3
1,Which of the following should be used by a farmer with a large farm to harvest his crops quickly and efficiently?,Winnowing machine,Combine,Sickle,Seed drill,option2
1,Forces can be:,Pushes only,Pulls only,Pushes and pulls,None of the above,option3
1,A force can cause an object to _________.,Accelerate,Slow down,Remain in place,All of the above,option4
1,The strength of a force is usually expressed by its,Length,Newton,Mass,Magnitude,option4
1,Which of the following is NOT an example of friction as a helpful force?,Using your hand to wave hello to a friend,Using a cloth to clean a pair of glasses,Using a marker to draw a picture on paper,Using a scrub brush to wash dishes,option1
1,Friction is a force that acts in a direction _________ to that of movement.,Similar,Opposite,Parallel,West,option2
1,Which of the following is an example of friction that is helpful?,Brakes used on a bike,Tires from a car on the road,Tread on the bottom of your shoes,All are examples that are helpful,option4
1,Which of the following is an example of a non-contact force?,Moon orbiting,Wind moving a sailboat,A duck floating on water,Your book lying on a table,option1
1,How do you measure pressure?,pressure = gravity / area on which it acts,pressure = mass / area on which it acts,pressure = force / area on which it acts,None of the above,option3
1,"When you increase your altitude, the air pressure",Increases,Decreases,Stays the same,Don't have any effect,option2
1,Fluid friction is also known as,Pull,Rub,Drag,Push,option3
1,Which of the following produces least friction?,Sliding friction,Rolling friction,Composite friction,Static friction,option2
1,What are the examples of rolling friction?,Slide in playgrounds,Ball bearings in machines,A moving cycle,Both ‘b’ and ‘c’,option4
1,What friction comes into play when we try to move an object at rest?,Static friction,Rolling friction,Sliding friction,Fluid friction,option1
1,Complete the sentence. Friction always,helps the motion,opposes the motion,Doesn’t affect the motion,none of these,option2
1,Which one of these characteristics does a smooth surface have?,Less frictional force,More frictional force,Sometimes less and sometimes more force,All of the above,option1
1,On what force of friction depends?,Smoothness of surface,Material of surface,Inclination of surface,All of the above,option4
1,Which of the following will offer least friction?,Wooden floor,Marble floor,Mud floor,Oily floor,option4
1,"When copper and magnesium sulfate are mixed together, there is no reaction. Why?",Magnesium is more reactive than copper,Copper is more reactive than magnesium,Copper never reacts with metal salts,Magnesium sulfate never reacts with metals,option1
1,A student added dilute hydrochloric acid to four metals and recorded his results. Which of the following results are correct?,No reaction with zinc,Gas given off with copper,Gas given off with magnesium,No reaction with iron,option3
1,A metal reacts with acid to produce salt and hydrogen gas. The same metal reacts with a base to again produce salt and hydrogen gas. What is that metal?,Zinc,Potassium,Magnesium,Iron,option1
1,Which of the following reactions is correct?,Al + NaOH → NaAlO2 + H2O,Al + NaOH → NaO + H2O,Al + NaOH → Al(OH)3 + H2O,Al + NaOH → NaAlO2 + H2,option3
1,"The ignition temperatures of four substances P, Q, R and S are 125°C ,270°C,155°C and 310°C respectively. Which of the following pairs of substances catches fire at 250°C.",Q and S,P and R,R and S,P and Q,option2
1,"Shyam was cooking potato curry on a chulha. To his surprise, he observed that the copper vessel was getting blackened from outside. What may be the reason?",Proper combustion of fuel,Improper cooking of potato curry,Improper combustion of fuel,Burning of copper vessel,option3
1,What is the main chemical component present in the striking surface of a matchbox?,Potassium chlorate,Phosphorus,Potassium,Graphite,option2
1,"Seena wants to put off the fire in the woods, so he poured water on it and it went off. What is the reason for it?",The temperature of the water went higher than its ignition temperature,The temperature of wood went lower than its ignition temperature,Water cut off the supply of oxygen to the woods,Water dissolved the fuel which was burning,option2
1,Bobo saw fire in a man’s dress. Which is the best way to extinguish the fire?,Throw water on the clothes,Use fire extinguisher,Cover the person with a woollen blanket,Cover the person with a polythene sheet,option3
1,Gappu was heating oil to fry potato chips. The cooking oil all of a sudden caught fire. How should the fire be extinguished?,Throw water over fire,Put sand on fire,Cover the pan with a lid,Both ‘b’ and ‘c’,option4
1,Choose the incorrect statement.,A small fire can be extinguished by throwing sand or soil over it.,"If the clothes of a person catch fire, the person should be immediately covered with a blanket.",Water can be used to douse any kind of fire,Carbon dioxide extinguishes fire without any damage to electrical appliances.,option3
1,What is true about reflected rays from plane mirrors?,Reflected rays meet behind a mirror thereby forming a virtual image,Reflected rays from a plane mirror meet in front of mirror thereby forming a real image,Reflected rays from a plane mirror meet in front of mirror thereby forming a virtual image,Reflected rays from a plane mirror never ever meet,option1
1,"A ray of light is incident on a plane mirror, and the angle of incidence is 25 degrees. What is the angle of reflection?",12.5 degrees,50 degrees,90 degrees,25 degrees,option4
1,Which type of corrective lens is used by elderly people for presbyopia?,Concave lens,Bifocal lens,Convex lens,No lens will work for this condition,Option3
1,"In an ultrasound exam, what frequency sound waves are sent into the body by a transducer? ",Less than 20 Hz,Less than 20000 Hz,More than 20000 Hz,More than 20 Hz but less than 20000 Hz,Option3
1,At high altitudes sometimes our ears pops or blocks. What happens at this time?,Eardrum is sucked inside,Eardrum is pushed out,Eardrum contracts,Eardrum expands,Option2
1,Why can the human ear not detect infrasounds?,Infrasounds are too loud,Infrasounds are too soft,Infrasounds are high-frequency sound,Infrasounds are low-frequency sound,Option4
1,Why can’t sound travel in space?,Space is too far away.,There is no matter in space.,Space does not exist.,Space has planets.,Option2
1,"Soft, low-pitched sound would have which of the following characteristics?","low frequency, high amplitude","high frequency, high amplitude","low frequency, low wavelength","low frequency, low amplitude",Option4
1,An object produces a sound of frequency 50 Hz. Pitch of sound is increased. Choose the correct statement.,Sound now has frequency less than 50 Hz,Sound now has frequency more than 50 Hz,Sound still has the same frequency of 50 Hz,None of the above,Option2
1,What happens when you increase the amplitude of a sound?,It makes the sound louder,It makes the sound travel faster,It increases the wavelength of the sound,It increases the frequency of the sound,Option1
1,Tap water is a good conductor of electricity while distilled water is not. Why?,Presence of dissolved minerals and salts in tap water allows current to flow,Distilled water does not contain any salt impurities and hence does not conduct electricity,Both (a) & (b) are correct,None of the above,Option3
1,What happens when salt is added to distilled water?,Distilled water becomes a good conductor of electricity,Distilled water becomes a poor conductor of electricity,No change in conductivity of distilled water,Distilled water becomes an insulator,Option1
1,"When current passes through a water and lemon juice mixture, bubbles form. What causes this?",Heating effect of current,Chemical effect of current,Magnetic effect of current,Lighting effect of current,Option2
1,What kind of processes are not observed as a result of the chemical effect of electric current.,Formation of gas bubbles at the electrodes,Deposit of metal on the electrodes,Electric motor begins to move,Change in color of the solution,Option3
1,Which of the following metals is used in electroplating to make objects appear shining?,iron,aluminium,copper,chromium,Option4
1,"Chromium plating is done on many objects such as car parts, bath taps, kitchen gas stoves, etc. Why?",It looks beautiful,It costs less,Articles can be sold at a high price,It does not corrode and prevents scratches,Option4
1,Which of the following cannot be charged by friction if held by hand?,A plastic scale,A copper rod,An inflated balloon,A woollen cloth,Option2
1,Which of the following are transferred from one object to another when these two objects are charged by friction?,Atoms,Protons,Neutrons,Electrons,Option4
1,"If air and clouds were good conductors of electricity, lightning would not occur. Why?",No charges will be generated in the clouds,Charges will not get accumulated in the clouds,Charges will flow through air to the earth,Both ‘b’ and ‘c’,Option4
1,"An earthquake measures 2 on the Ritcher scale, would it be recorded by seismograph?",No,Yes,Sometimes,None of the above,Option2
1,In how many seismic zones India is divided and the 2005 Muzaffarabad earthquake occurred on which of the active faults?,"1, Kangra Active fault","2, San Andreas fault","6, Main Boundary thrust","4, Tanda Active faults",Option4
1,How much of the moon is always lit?,Can't tell,Always changes,Half,¾,option3
1,Sahil saw the full moon on 3rd September. On which date will he see the full moon again?,2-Oct,3-Oct,4-Oct,5-Oct,Option2
1,Anil observed that the size of the moon keeps changing. He is wondering what could be the reasons behind this?,Revolution of the moon around the earth,Rotation of the moon around the earth,Revolution of the Earth around the sun,Both ‘a’ and ‘c’,option4
1,Which of the following would happen if the moon emits light of its own?,No shadows will be formed,Day and night cannot be distinguished,No phases of the moon will be formed,Phases of the moon will be formed,option3
1,Full moon appeared on 21st July. What will be the date of the new moon day?,4th August,5th August,6th August,7th August,option2
1,What might happen if Saturn is thrown into an ocean.,It will float,It will sink,It will dissolve,It will soak all water,option1
1,Why is it difficult to observe Mars?,It is the smallest planet of this universe,It is too far away from our planet,It is hidden by the glare of the sun,None of the above,Option3
1,Ali chose some crops to sow in the rainy season. Choose the crops which can't be grown in that season.,Paddy,Wheat,Gram,Both 'b' and 'c',option4
1,Rani had an uneven plot of land in which water was scarce. What system could she adopt for irrigation?,Sprinkler system,Canal irrigation,Motor pump,Hand pump,option1
1,Rohan is planning to sow some seeds in October. Which crop will he not choose for it?,Paddy,Wheat,Gram,Pea,option1
1,Baisakhi is a harvest festival celebrated in the month of February. Which crop is harvested during this festival?,Rabi crops,Kharif crops,Zaid crops,None of the above,option1
1,Rohan is searching for a funnel-shaped tool to sow seeds. Identify the tool he is looking for.,Plough,Hoe,Traditional tool,Seed drill,option3
1,Manure and fertilisers are added to improve soil fertility. What are some of the other methods which can be used for the same?,Crop rotation,Multi Cropping and intercropping,Growing leguminous plants,All of the above,option4
